<?xml version="1.0" encoding="UTF-8"?>
<!DOCTYPE orders SYSTEM 'orders.dtd'>
<orders><order OrderID="OO001"><OrderDate>2020-01-21</OrderDate><OrderStatus>COMPLET</OrderStatus><TotalAmount>50.00</TotalAmount><CustomerId/></order><order OrderID="OO002"><OrderDate>2020-01-21</OrderDate><OrderStatus>COMPLET</OrderStatus><TotalAmount>50.00</TotalAmount><CustomerId/></order><order OrderID="OO003"><OrderDate>2020-01-21</OrderDate><OrderStatus>COMPLET</OrderStatus><TotalAmount>50.00</TotalAmount><CustomerId/></order></orders>
